{
  "$schema": "https://json-schema.org/draft/2020-12/schema",
  "type": "object",
  "required": [
    "project",
    "task",
    "release",
    "source_commit",
    "ring_center_z_mm",
    "thickness_mm",
    "permitted_z_band_mm",
    "leg_angles_deg",
    "section_samples_z_mm",
    "core_clearance_from_cheek_inner_mm",
    "arm_width_mm",
    "slot_allowance_each_side_mm",
    "slot_corner_radius_mm",
    "A",
    "B",
    "C",
    "cheek_insertion_t_mm",
    "key_vertical_stroke_mm",
    "ring_trial_stroke_mm",
    "geometric_neck_screen_mm",
    "cheek_outer_land_screen_mm",
    "sheet_hw_mm",
    "sheet_margin_mm",
    "raster_dpi",
    "circle_segments",
    "fillet_chord_tolerance_mm",
    "measured_kerf_mm",
    "measured_thickness_mm",
    "relevant_interfaces",
    "epsilon_mm3",
    "outer_fillet_radius_mm"
  ],
  "additionalProperties": false,
  "properties": {
    "project": {
      "const": "CTB-01"
    },
    "task": {
      "const": "CTB-006"
    },
    "release": {
      "const": "DESIGN_ONLY"
    },
    "source_commit": {
      "const": "c27f722e16668e4ed32cee1c72f5a699b40e504e"
    },
    "ring_center_z_mm": {
      "const": 245
    },
    "thickness_mm": {
      "const": 6
    },
    "permitted_z_band_mm": {
      "const": [
        225,
        265
      ]
    },
    "leg_angles_deg": {
      "const": [
        0,
        120,
        240
      ]
    },
    "section_samples_z_mm": {
      "const": [
        225,
        230,
        235,
        240,
        242,
        245,
        248,
        250,
        255,
        260,
        265
      ]
    },
    "core_clearance_from_cheek_inner_mm": {
      "const": 12
    },
    "arm_width_mm": {
      "const": 14.6
    },
    "slot_allowance_each_side_mm": {
      "const": 0.2
    },
    "slot_corner_radius_mm": {
      "const": 0.2
    },
    "A": {
      "const": {
        "band_width_mm": 16,
        "tab_radial_width_mm": 12,
        "tab_abs_t_mm": 13.5
      }
    },
    "B": {
      "const": {
        "band_width_mm": 24,
        "tab_radial_width_mm": 12,
        "tab_abs_t_mm": 13.5,
        "loading_lift_mm": 6.4,
        "joint_neck_width_mm": 6,
        "joint_head_width_mm": 10,
        "joint_depth_mm": 6,
        "joint_clearance_mm": 0.2,
        "stop_head_r_offsets_mm": [
          -19,
          -13
        ],
        "stop_head_z_mm": [
          238.8,
          257.6
        ],
        "stop_stem_start_r_offset_mm": -15,
        "stop_radius_mm": 0.5
      }
    },
    "C": {
      "const": {
        "band_width_mm": 12,
        "tab_radial_width_mm": 26,
        "tab_abs_t_mm": 26.5,
        "key_slot_r_width_mm": 6.4,
        "key_slot_t_range_mm": [
          13.5,
          20.3
        ],
        "key_neck_t_mm": [
          13.7,
          19.7
        ],
        "key_neck_z_mm": [
          235,
          248
        ],
        "key_head_t_mm": [
          13.7,
          22
        ],
        "key_head_z_mm": [
          248,
          256
        ],
        "key_radius_mm": 0.4
      }
    },
    "cheek_insertion_t_mm": {
      "const": 40
    },
    "key_vertical_stroke_mm": {
      "const": 40
    },
    "ring_trial_stroke_mm": {
      "const": 60
    },
    "geometric_neck_screen_mm": {
      "const": 6
    },
    "cheek_outer_land_screen_mm": {
      "const": 8
    },
    "sheet_hw_mm": {
      "const": [
        800,
        440
      ]
    },
    "sheet_margin_mm": {
      "const": 10
    },
    "raster_dpi": {
      "const": 96
    },
    "circle_segments": {
      "const": 360
    },
    "fillet_chord_tolerance_mm": {
      "const": 0.002
    },
    "measured_kerf_mm": {
      "const": null
    },
    "measured_thickness_mm": {
      "const": null
    },
    "relevant_interfaces": {
      "const": [
        "IF-09",
        "IF-01",
        "IF-02",
        "IF-14"
      ]
    },
    "epsilon_mm3": {
      "const": 1e-06
    },
    "outer_fillet_radius_mm": {
      "const": 0.5
    }
  }
}
