{
  "project": "CTB-01",
  "task": "CTB-006",
  "release": "DESIGN_ONLY",
  "source_commit": "c27f722e16668e4ed32cee1c72f5a699b40e504e",
  "ring_center_z_mm": 245,
  "thickness_mm": 6,
  "permitted_z_band_mm": [
    225,
    265
  ],
  "leg_angles_deg": [
    0,
    120,
    240
  ],
  "section_samples_z_mm": [
    225,
    230,
    235,
    240,
    242,
    245,
    248,
    250,
    255,
    260,
    265
  ],
  "core_clearance_from_cheek_inner_mm": 12,
  "arm_width_mm": 14.6,
  "slot_allowance_each_side_mm": 0.2,
  "slot_corner_radius_mm": 0.2,
  "A": {
    "band_width_mm": 16,
    "tab_radial_width_mm": 12,
    "tab_abs_t_mm": 13.5
  },
  "B": {
    "band_width_mm": 24,
    "tab_radial_width_mm": 12,
    "tab_abs_t_mm": 13.5,
    "loading_lift_mm": 6.4,
    "joint_neck_width_mm": 6,
    "joint_head_width_mm": 10,
    "joint_depth_mm": 6,
    "joint_clearance_mm": 0.2,
    "stop_head_r_offsets_mm": [
      -19,
      -13
    ],
    "stop_head_z_mm": [
      238.8,
      257.6
    ],
    "stop_stem_start_r_offset_mm": -15,
    "stop_radius_mm": 0.5
  },
  "C": {
    "band_width_mm": 12,
    "tab_radial_width_mm": 26,
    "tab_abs_t_mm": 26.5,
    "key_slot_r_width_mm": 6.4,
    "key_slot_t_range_mm": [
      13.5,
      20.3
    ],
    "key_neck_t_mm": [
      13.7,
      19.7
    ],
    "key_neck_z_mm": [
      235,
      248
    ],
    "key_head_t_mm": [
      13.7,
      22
    ],
    "key_head_z_mm": [
      248,
      256
    ],
    "key_radius_mm": 0.4
  },
  "cheek_insertion_t_mm": 40,
  "key_vertical_stroke_mm": 40,
  "ring_trial_stroke_mm": 60,
  "geometric_neck_screen_mm": 6,
  "cheek_outer_land_screen_mm": 8,
  "sheet_hw_mm": [
    800,
    440
  ],
  "sheet_margin_mm": 10,
  "raster_dpi": 96,
  "circle_segments": 360,
  "fillet_chord_tolerance_mm": 0.002,
  "measured_kerf_mm": null,
  "measured_thickness_mm": null,
  "relevant_interfaces": [
    "IF-09",
    "IF-01",
    "IF-02",
    "IF-14"
  ],
  "epsilon_mm3": 1e-06,
  "outer_fillet_radius_mm": 0.5
}
